text,label
camera battery life tactile property feel free gratis share pic comment color get fourth dimension have hard time find professional professional Max lol,Positive
get new   Pro Max anybody discoloration underneath volume button appear smudge fingerprint,Neutral
PSA current phone work fine call emergency service text able guy cable new phone not afford care color phone apple improve camera smidge charge $ + care change charge port People want communicate stay strong focus journey rarely mall drop present friend work Apple Store shock line wove mall phone mall hire police officer economy way folk stretch inflation rear think leave out d witness see today ask guy line big look at phone shrug say change charge port hold old phone high cherish work fine allege not cost effective phone edit typo edit read actual brand check sub Debt Free sub encourage people credit payment plan not afford dang phone debt free pay,Positive
iphone professional face absolutely issue legal opinion master professional willing belief upgrade professional issue opinion hold,Positive
"course notable photo think phone dark mode frustrating not think screen retention icon remain visible week calendar icon 
 ask replacement Apple m wait receive new phone hope well 

 excuse bad english",Negative
datum data point phone check earpiece phone bargain,Positive
detail data point datum datum check earpiece buy,Neutral
issue alarm fail morning like usually set sequential alarm picture alarm actually sound wake find early alarm remain set fail sound recur alarm not reset go snooze alarm happen incredibly inconvenient time actually want wake,Negative
ride moped lay street look like run couple time get home surprised find screen protector crack case protect rest phone perfect condition phone dead Siri lock password find belong   hour call lost mode way know find own m sure lose love nice durable phone thought,Positive
datum leverage check data point headphone earphone purchase,Neutral
"think iPhone   Pro   Pro series pretty high demand give hard month   pro get backordere ~ minute not see Apple Stores busy long time 

   pro nice improvement particularly groundbreaking flashy compare   Pros regular s get good upgrade year nice color not one sell fast 

 think make people upgrade year",Positive
get new button newfangled Pro Max anybody discoloration underneath intensity clit pro appear smudge fingerprint,Neutral
phone slip pocket sit car door open land road ve phone   day hopefully fix suggestion apple care+,Positive
"course notable photo think phone dark mode frustrating not think screen retention icon remain visible week calendar icon 
 ask replacement Apple m wait receive new phone hope well 

 excuse bad english",Negative
s character huge dancing tone dance step leather type replace,Positive
"course notable photo think phone dark mode frustrating not think screen retention icon remain visible week calendar icon 
 ask replacement Apple m wait receive new phone hope well 

 excuse bad english",Negative
not care money rule deal person say consultation na way kaya siya nakabili year eh dahil sa ~~pambuburaot~~ diskarteng Pinoy ie minsan nanghihingi na lang siya nanogram pagkain sa mga kawork para movement ipunin yung pera paratrooper instead na gumasto pa money rule irk like standard keep trend day bad example na people look sa mga comment section lol,Negative
see ton negative review article \-easily quip charles frederick worth trending example limited review moment \-battery easily drain \-overheate \-buggy software worth minus buy,Positive
"PSA 

 current phone work fine call emergency service text able new phone not afford care color phone apple improve camera smidge charge $ + 

 care change charge port People want communicate stay strong focus journey 

 rarely mall drop present friend work Apple Store shock line wove mall phone mall hire police officer economy way folk stretch inflation rear think d witness see today 

 ask guy line big deal phone shrug say change charge port 

 hold old phone high cherish work fine not cost effective phone 

  edit typo 

 edit read actual post check sub Debt Free sub encourage people credit payment plan   not afford dang phone debt free pay",Positive
PSA current phone work fine call emergency service text able new phone not afford care color phone apple improve camera smidge charge $ + care change charge style port People want communicate stay strong focus journey rarely mall drop present friend work Apple Store shock line wove mall phone mall hire police officer economy way folk stretch inflation rear think d witness see today ask guy line big deal phone shrug aver change charge port book old phone high cherish work fine not cost effective shopping mall phone edit typo edit read actual post check sub Debt Free sub encourage people credit payment plan not afford dang phone monetary value debt free pay,Positive
take hold iphone pro face utterly payoff pro willing upgrade pro confine payoff feeling professional hold,Positive
"good morning 

 pick iPhone   pm Natural Titanium Friday box scratch decide Mothers Mag try send Lo behold trick want let people know light scratch frame polishable impact finish",Positive
order AT&T right away Pro easy lay rightfulness trade offer new Pro easy lay come mail total today crack right corner look like touch crock up on sharply AT&T replace loose box arrival,Positive
devolve on moped lay street look like discharge couple time get home surprised find uncovering screen protector crack case protect rest phone perfect condition phone dead Siri lock speech sound password find belong hour call lost defender mode way know find own m sure lose love nice durable phone thought,Positive
lighting good sunrise pick iPhone pm Natural Titanium Friday box scratch decide Mothers Mag try send loge Lo behold trick want let the great unwashed know light scratch frame polishable impact scrape up finish,Positive
follow come late phoebe like iPhone quintuplet original quint iPhone,Positive
issue alarm fail morning like usually set sequential alarm picture alarm actually sound wake find early alarm remain set fail sound recur alarm not reset go snooze alarm happen incredibly inconvenient time actually want wake,Negative
iphone pro case dead issue pro leave willing issue upgrade issuance pro issue feeling hold,Negative
"course notable photo think phone dark mode frustrating not think screen retention icon remain visible week calendar icon 
 ask replacement Apple m wait receive new phone hope well 

 excuse bad english",Negative
iPhone health electric health health battery wellness,Positive
bourgeon pullulate knife pullulate stab,Negative
ride moped lay street calculate dearest speech sound like run couple time get home surprised find screen protector crack case protect rest phone perfect condition phone absolutely Siri lock possess password find belong hour call lost mode way know find own m sure lose love nice durable phone thought,Positive
course notable photo think phone dark mode trend frustrating not think screen keeping intend involve icon remain visible week calendar icon ask replacement Apple m wait receive new phone hope well excuse big english,Positive
issue alarm fail morning in reality like usually set sequential alarm picture alarm actually sound backwash find race early alarm remain set fail sound recur alarm go back not reset go snooze alarm happen incredibly inconvenient time actually need backwash,Negative
adopt picture comparable one visualise attach live hold upto final view good picture unmatched end look like comparable pls help,Positive
talent iPhone pro deliver yesterday morning yesterday evening send Network not sort contract time get reduce play upgrade iPhone normal pro excited huge difference not feel feel ve big difference previous upgrade take exposure th non zoom not difference sound quality pro hear breath record feel like white colour strong screen make video exposure feel direct fake pro compare read notice play long upgrade feel huge expect especially pro model,Positive
datum check phone buy,Neutral
untimely alike follow premature like previous iPhone master copy vs iPhone,Positive
phone slip pocket sit car door open land road ve phone   day hopefully fix suggestion apple care+,Positive
notice phone get particularly hot phone ve hear report wizard people have abnormally hot iPhone pro document temperature Ill leave get hot m afraid touch hurt wooden leg pocket ve hear support hot charge social medium s case phone actually cool touch browse slightly warm charging minute phone phone pipe hot take work excite decide see hot camera phone pretty allow difficult reading light reflective reach F. ve reset restore try make phone restore thing time m take genius bar tomorrow not hold hope,Positive
"long year handful android phone finally iPhone brief phone history iPhone iPhone XS Max > Galaxy fold > Pixel > Galaxy Flip > Pixel   pro > Galaxy Flip > Galaxy Flip finally   plus receive Thursday 

 m honeymoon phase thing m enjoy far iPhone 

 Battery life battery life   plus insane not hard feat come foldable flip know bad battery life Pixel   pro mah battery terrible battery life 

 social medium app camera quality android come long way near iPhones especially limit phone model s series optimise degree foldable not etc 

 App quality app well design ios haptic feedback present rd party app smarthome app run well banking app etc 

 reliability m worried go wrong iPhone android phone iPhone camera usable image single time Samsung especially Pixel capture impressive shot take shot WTF samsung slow shutter speed shutter lag impossible shot dog pixel questionable video quality   Pro terrible camera literally friend ask camera crack bad quality video calling connectivity pixel   pro know connectivity issue man not ready bad struggle reception normally phone gps suck point recalibrate google map time Flip   lose connection m mobile datum need restart phone 

 lastly incident week like joke friend ask m iPhone friend decide Yo Chi frozen yoghurt place Australia decide sign member go download app not let not compatible device Flip 

 TLDR m enjoy time iPhone   plus m sure honeymoon phase Ill annoy ios quirk right m like   Plus",Negative
PSA current phone work fine vociferation emergency service text able new phone not afford care color phone apple improve camera smidge charge $ + care change charge port People want communicate treasure stay strong focus journey rarely mall drop present friend work Apple Store shock line wove mall phone mall hire police officer economy way folk nowadays stretch inflation rear think d witness see today ask guy line big deal phone shrug say change charge port hold old phone high cherish work fine not cost effective phone edit typo edit read actual post tick orchard apple tree off sub Debt Free sub encourage people credit payment plan not afford dang phone debt free pay,Positive
suppose iPhone Pro Pro series pretty high demand give hard month pro get backordere ~ minute not see Apple Stores busy yr long time pro nice improvement particularly groundbreaking flashy comparison Pros regular s get good upgrade year realize nice color not one sell fast suppose make people upgrade hoi polloi year,Positive
"think iPhone   Pro   Pro series pretty high demand give hard month   pro get backordere ~ minute not see Apple Stores busy long time 

   pro nice improvement particularly groundbreaking flashy compare   Pros regular s get good upgrade year nice color not one sell fast 

 think make people upgrade year",Positive
"iPhone   seven year able upgrade big investment work 

 thank people respond post time want share",Positive
petty follow previous piddling the likes stick to of iPhone original little phoebe iPhone,Positive
ride mope lay perfect tense street look like run copulate time get home surprised find screen protector get crack case protect rest phone perfect condition phone dead Siri whirl lock password find belong hour call lost mode way know find own m sure lose love nice durable phone thought,Positive
editing not weird color rejoin return issue disappear single shot necessitate overexposed need manually sweep exposure iPhone pro see thing similar iPhone,Negative
facial expression sit moped lay street look like run meter couple time get home surprised find screen protector crack case protect rest phone perfect condition phone dead Siri lock password find belong hour call lost mode way get laid find own m sure lose love mope nice durable phone thought,Positive
iphone pro case absolutely go forth pro professional willing guinea pig upgrade flavor pro go forth feeling hold,Positive
not care money rule mortal say interview na way kaya siya nakabili year eh dahil or else sa ~~pambuburaot~~ diskarteng Pinoy internet explorer minsan nanghihingi na lang siya ng pagkain storm troops sa mga kawork para ipunin yung pera instead papa na gumasto pa money rule irk like standard keep trend day bad example na people look sa mga comment section lol,Negative
magazine good morning pick iPhone pm Natural Titanium Friday box scratch decide Mothers mag try send Lo behold trick hoi polloi want let people know essay idle scratch frame polishable impact finish,Positive
think iPhone Pro Pro series pretty high demand give hard month pro thoroughly get backordere class ~ minute not see Apple Stores busy long time pro nice improvement particularly groundbreaking flashy compare Pros regular sulphur get good upgrade year nice color not ace sell pro fast think make people upgrade year,Positive
s huge step leather case replace,Positive
"iphone   pro face absolutely issue 

   pro willing upgrade   pro issue feeling hold",Positive
charge shoot down bolt down bolt down tear,Negative
not care money rule person say interview or else na way kaya siya nakabili year clarence shepard day jr eh dahil sa ~~pambuburaot~~ diskarteng Pinoy ie minsan nanghihingi na lang siya ng pagkain sa rein mga kawork para ipunin yung pera instead na gumasto pa money rule gall like standard keep trend day bad example na people look sa mga gossip section lol,Negative
issue alarm fail morning like usually set sequential stay alarm photo alarm actually sound wake find early stick around alarm remain set fail sound recur alarm not reset go cat sleep alarm happen incredibly alarm system inconvenient time actually want wake,Negative
s supercede supervene upon immense measure supplant leather case replace,Neutral
take picture like one attach live hold upto final view good picture end look like pls help,Positive
look like chain string up improving lightning cables mountain range length,Positive
take picture similar one attach live retain upto painting final view good picture last painting end look similar pls help,Positive
get iPhone   pro max release day love far hear people experience burn issue theirs not notice couple night ago start small look like ghosting inspection definitely burn put dark gray image low brightness reveal likely Apple Store time week image bit exaggerated come straight iPhones camera second image well representation look like naked eye,Positive
"
 iPhone   battery health",Neutral
"PSA 

 current phone work fine call emergency service text able new phone not afford care color phone apple improve camera smidge charge $ + 

 care change charge port People want communicate stay strong focus journey 

 rarely mall drop present friend work Apple Store shock line wove mall phone mall hire police officer economy way folk stretch inflation rear think d witness see today 

 ask guy line big deal phone shrug say change charge port 

 hold old phone high cherish work fine not cost effective phone 

  edit typo 

 edit read actual post check sub Debt Free sub encourage people credit payment plan   not afford dang phone debt free pay",Positive
s huge show vitrine stair randomness leather display case replace,Positive
ve tear color s favorite order whitened recollect m think change natural lifelike non recall decide,Positive
long year handful android phone finally iPhone brief phone history iPhone iPhone XS Max > Galaxy fold > Pixel exclusive > Galaxy Flip > Pixel pro > Galaxy Flip > Galaxy Flip finally plus receive Thursday m honeymoon phase thing m enjoy far iPhone Battery life battery life plus insane not project hard feat come foldable flip know bad battery life Pixel pro mah battery terrible battery life social medium app camera quality android come long way near iPhones especially limit phone model s series optimise degree foldable not etc App quality app well design ios haptic feedback present rd party app smarthome app run well banking app etc reliability m worried go wrong iPhone android phone iPhone camera usable image single time Samsung especially Pixel capture impressive shot take shot WTF samsung slow shutter speed shutter lag insufferable shot dog pixel questionable video quality Pro terrible camera literally friend ask camera crack bad quality video calling connectivity pixel pro know connectivity issue man not ready bad struggle receipt normally phone gps suck point recalibrate google map time Flip lose connection m mobile datum need restart phone lastly incident week like joke friend ask m iPhone friend decide Yo Chi frozen yoghurt place Australia decide sign member go download app galax urceolata not let not compatible device Flip TLDR m enjoy time iPhone plus m sure honeymoon phase Ill annoy ios quirk right m like Plus,Negative
look the like hang care lightning cablegram cable line television,Positive
gift iPhone pro rescue yesterday morning yesterday evening send Network not sort contract time get play upgrade iPhone normal pro excited huge difference not feel feel ve big difference previous upgrade take photo th zoom not difference sound quality pro hear breath record feel like white colour strong screen attain video photo feel fake pro compare braggart professional read notice play long upgrade feel huge expect especially professional person pro model,Positive
uncanny redaction not barb weird color issue non disappear single shot overexposed need manually drag exposure iPhone pro see affair like iPhone,Positive
bulk get new newfangled Pro Max anybody discoloration underneath volume button come modern out blot fingerprint,Neutral
take picture like one attach live hold upto final view good picture end look like pls help,Positive
phone slip pocket sit auto door open land route ve phone day machine hopefully car fix suggestion call up apple care+,Positive
follow previous like iPhone original vs iPhone,Positive
phone slip bring pocket sit car orchard apple tree door open land road ve daytime phone clarence day hopefully fixate suggestion apple care+,Positive
phone slip pocket sit car door open land road ve phone   day hopefully fix suggestion apple care+,Positive
"
 not fun color line device",Negative
get new iPhone pro Pro matter trade Pro immediately notice huge difference picture quality use phone daily photograph sell sneaker online camera important thing talk apple try software issue maybe get defective product pronounce look normal picture Nike Air Max shoe take photo light box Pro second bright true color Pro georgia home boy shoe background look yellow take exact way have issue quality,Positive
s huge step leather case replace,Positive
think iPhone Pro Pro series pretty high demand give hard calendar month pro acclivity get backordere ~ minute not see pro Apple Stores busy long tatty time pro nice improvement particularly groundbreaking flashy compare Pros regular s get good upgrade year nice color not one sell fast think make masses upgrade year,Positive
notice phone get particularly hot phone ve hear report people have abnormally hot iPhone pro document temperature Ill leave get hot m stupefy afraid touch hurt peg pocket ve hear support hot charge bewilder social medium s case phone actually cool touch browse slightly warm charging minute phone phone pipe hot take shape societal decide catch hot camera phone pretty difficult reading light reflective reach F. ve reset restore try make phone restore thing time m take genius bar tomorrow not hold hope,Positive
"not care money rule person say interview na way kaya siya nakabili year eh dahil sa ~~pambuburaot~~ diskarteng Pinoy ie minsan nanghihingi na lang siya ng pagkain sa mga kawork para ipunin yung pera instead na gumasto pa 

 money rule irk like standard keep trend day bad example na people look sa mga comment section lol",Negative
go Nashville thanksgiving go out Jason leave observe Aldeans bar Broadway realize miss pocket lose mode find get strange message iMessage ring direction forget device get email apple tell activation lock request password iphone check location see Shenzhen china erase device will forget device bc want factory reset idea phone location infamous steal phone,Negative
datum check tally call up upwards outcry bargain,Negative
PSA current phone work fine call emergency service text able new phone not afford care color phone apple improve camera smidge charge $ ring + care change charge port People want communicate stay strong focus journey rarely mall drop present friend work Apple Store shock line wove mall phone mall hire police officer economy way folk stretch inflation rear think d witness see today ask guy line big deal phone witness shrug say change charge port hold old phone high cherish work fine not cost effective phone edit typographical error edit read actual post check sub Debt Free sub encourage people impact credit payment plan not afford dang phone debt free remuneration,Positive
goading poke prod dash stab,Negative
not fun non color non personal credit line twist gimmick,Neutral
good morning pick iPhone pm Natural Titanium Friday box scratch decide expunge Mothers Mag try send Lo transport friday behold trick want let people know light scratch set up polishable affect finish,Positive
endowment iPhone pro deliver yesterday morning yesterday evening send Network not sort contract time get play upgrade iPhone normal pro excited huge difference not feel feel ve big flavour difference previous upgrade take photo th zoom postiche not difference sound quality pro hear breath record feel like white colour strong screen make video photo feel fake pro compare non read notice play long upgrade feel huge expect especially pro manikin,Positive
ingest camera assault and battery life feel free share pic comment notice color television camera get have hard time find professional Pro Max lol,Positive
follow previous like iPhone original vs iPhone,Positive
issue alarm fail morning like usually set sequential alarm picture alarm actually sound wake find early alarm remain set fail sound recur alarm not reset go snooze alarm happen incredibly inconvenient time actually want wake,Negative
get new iPhone   Pro trading   Pro immediately notice huge difference picture quality use phone daily photograph sell sneaker online camera important thing talk apple try software issue maybe get defective product say look normal picture Nike Air Max shoe take photo light box   Pro second bright true color   Pro shoe background look yellow take exact way have issue quality,Positive
barrage fire ardor iPhone shelling barrage fire wellness,Negative
look like hang lightning cable,Positive
get new iPhone Pro trading Pro immediately notice huge difference picture quality use phone daily photograph sell sneaker online camera important thing talk apple try software shiny issue maybe get defective production trade say look normal babble out picture nike Air Max shoe take photo light box Pro second bright true color Pro shoe background look yellow take exact way have issue quality,Positive
iPhone seven year able upgrade big investment work heavy out portion out thank people septet respond position time want share,Positive
follow like pilot former ilk iPhone original vs play along iPhone,Positive
good morning pick iPhone pm Natural Titanium Friday loge scratch decide Mothers Mag try rub judge send pelf Lo behold trick want let people know tripping scratch frame polishable impact finish,Positive
"think iPhone   Pro   Pro series pretty high demand give hard month   pro get backordere ~ minute not see Apple Stores busy long time 

   pro nice improvement particularly groundbreaking flashy compare   Pros regular s get good upgrade year nice color not one sell fast 

 think make people upgrade year",Positive
not non fun color line not playfulness gimmick,Negative
good morning pick iPhone pm Natural Titanium Friday box gelt decide Mothers Mag try send Lo behold antic play tricks want let people know light gelt free rein wreak frame polishable impact finish,Positive
go Nashville thanksgiving leave Jason Aldeans bar Broadway   realize miss pocket lose mode find get strange message iMessage direction forget device get email apple say activation lock request password iphone check location see Shenzhen china erase device will forget device bc want factory reset idea phone location infamous steal phone,Negative
"
 iPhone   battery health",Neutral
go Nashville thanksgiving leave Jason Aldeans bar Broadway realize miss pocket lose mode find get strange found message iMessage direction forget device get email apple say activation lock request steering password iphone check location see Shenzhen china erase device will forget device bc want manufacturing stripe plant reset idea speech sound location infamous steal speech sound,Negative
good morning break up iPhone post mortem examination pm natural Titanium Friday box scratch decide Mothers Mag try lie with send Lo behold bear upon trick want let people know light scratch frame polishable impact finish,Positive
