text,label
notice phone get particularly spicy phone ve hear report people have abnormally spicy iPhone pro document temperature Ill leave get spicy m afraid touch hurt leg pocket ve hear support in reality spicy charge social culture medium s case phone actually cool touch browse slightly warm charging minute phone phone pipe spicy take work decide catch spicy camera in reality phone pretty difficult reading light reflective reach F. ve reset restore try make phone restore thing time m take genius bar piquant tomorrow not hold hope,Positive
depressed flick shoot mastered down film,Negative
"notice phone get particularly hot phone ve hear report people have abnormally hot iPhone   pro document temperature Ill leave 

 get hot m afraid touch hurt leg pocket ve hear support hot charge social medium s case phone actually cool touch browse slightly warm charging minute phone phone pipe hot take work decide catch hot camera phone pretty difficult reading light reflective reach F. 

 ve reset restore try make phone restore thing time m take genius bar tomorrow not hold hope",Positive
iPhone outrage assault outrage and battery health wellness,Negative
see long prospicient ton negative review \-easily crack trending example moment \-battery easily drain \-overheate \-buggy software veto deserving foresightful buy,Neutral
get iPhone   pro max release day love far hear people experience burn issue theirs not notice couple night ago start small look like ghosting inspection definitely burn put dark gray image low brightness reveal likely Apple Store time week image bit exaggerated come straight iPhones camera second image well representation look like naked eye,Positive
image ton negative review \-easily crack trending example moment \-battery easily figure form debilitate \-overheate \-buggy scissure software worth buy,Positive
go Nashville allow for thanksgiving leave Jason Aldeans bar Broadway realize drop pocket lose mode find get twist strange message iMessage direction forget device get email apple interlace say activation lock request watchword iphone check location see Shenzhen china erase device will forget device bc want factory reset idea phone location infamous steal phone,Negative
not fun tinge undertone line distort tinge gimmick,Negative
get new iPhone   Pro trading   Pro immediately notice huge difference picture quality use phone daily photograph sell sneaker online camera important thing talk apple try software issue maybe get defective product say look normal picture Nike Air Max shoe take photo light box   Pro second bright true color   Pro shoe background look yellow take exact way have issue quality,Positive
thingummy not non fun twist color line gimmick,Negative
think iPhone Pro Pro masses series pretty high demand give gruelling peculiarly month pro get backordere ~ minute not see Apple Stores engaged long time pro nice improvement particularly groundbreaking flashy compare Pros regular s get good upgrade year nice color not one sell deal fast think make people upgrade year,Positive
get iPhone pro max release oculus day love far hear people experience burn issue theirs not notice couple count night ago start get laid small look like ghosting inspection definitely burn put dark gray image low brightness reveal likely Apple Store sentence week image bit exaggerated come straight iPhones camera minute image well representation look like naked eye,Positive
"camera battery life 

 feel free share pic comment color get have hard time find   pro Pro Max lol",Positive
"
 not fun color line device",Negative
"shoot shot 
",Negative
go Nashville blessing leave Jason Aldeans bar Broadway realize miss pocket lose mode find get strange message iMessage direction forget device get email earpiece apple say activation lock request password iphone positioning check location see Shenzhen red china erase device will forget device bc mill want factory reset idea phone location infamous steal phone,Negative
ride moped lay street sleep feel like run running game couple time get home surprised find screen protector crack case protect rest phone perfect condition phone dead Siri lock password find belong to hour call lost mode way know find own m sure lose mislay love nice durable phone thought,Positive
iphone pro face opinion absolutely issue pro willing ascent emergence utterly pro issue notion hold,Neutral
datum check phone buy,Neutral
wire look wish alike fall like lightning cable,Positive
phone slip pocket sit car door open land road ve phone   day hopefully fix suggestion apple care+,Positive
tease moped lay street look like run couple time get have home surprised find screen protector crack case protect rest phone perfect condition phone dead Siri lock password find skillful belong hour call lost mode way know find own ring m sure lose love nice long lasting phone thought,Positive
phone slip pocket sit route malus pumila car door open land road ve phone hour interval hopefully fix prompting speech sound apple care+,Positive
"notice phone get particularly hot phone ve hear report people have abnormally hot iPhone   pro document temperature Ill leave 

 get hot m afraid touch hurt leg pocket ve hear support hot charge social medium s case phone actually cool touch browse slightly warm charging minute phone phone pipe hot take work decide catch hot camera phone pretty difficult reading light reflective reach F. 

 ve reset restore try make phone restore thing time m take genius bar tomorrow not hold hope",Positive
tell AT&T right out Pro Max trade offer slack new Pro Max come mail today crack right corner look like impact chain armor topnotch sharply AT&T replace loose box arrival,Positive
"shoot shot 
",Negative
PSA current phone work fine call emergency service text able new call up phone not afford game care color phone apple improve camera smidge charge $ + care change charge port People want communicate stay strong yield focus journey rarely mall drop present friend work Apple Store shock line wove mall phone mall hire police officer economy way folk stretch inflation rear think d witness see today ask guy line big deal phone shrug say change charge port hold old phone gamy cherish work fine not cost effective phone edit typo edit read existent post check sub Debt Free sub encourage people credit payment plan not afford dang phone debt free pay,Positive
ride moped lay street look like run couple time get home surprised find screen protector crack case protect rest phone perfect condition phone dead Siri lock password find belong   hour call lost mode way know find own m sure lose love nice durable phone thought,Positive
good dawn pick iPhone pm Natural Titanium Friday box scratch decide Mothers endeavour Mag try send Lo born behold trick want let lightness people know light scratch frame polishable impact end,Positive
not charge money rule person say interview na way kaya siya nakabili year eh dahil sa ~~pambuburaot~~ diskarteng Pinoy ie minsan nanghihingi na lang sooner siya ng pagkain sa mga kawork para ipunin yung pera rather na pascal gumasto hold back pa money rule irk like standard keep trend day bad example na people look sa mga comment section lol,Positive
go Nashville thanksgiving leave Jason Aldeans bar Broadway realize miss pocket lose mode chance get strange message iMessage direction forget device get email apple bequeath articulate activation lock request password iphone check location see Shenzhen china notorious erase device will forget device bc want factory reset idea phone location infamous score out steal phone,Negative
get new iPhone Pro brobdingnagian trading freshly Pro immediately notice huge difference picture quality use phone daily photograph sell snitch online camera important thing talk apple try software issue maybe get defective product say look normal picture Nike Air Max horseshoe claim take photo light box Pro second bright true color Pro horseshoe background look yellow take exact way have issue quality,Positive
get new iPhone   Pro trading   Pro immediately notice huge difference picture quality use phone daily photograph sell sneaker online camera important thing talk apple try software issue maybe get defective product say look normal picture Nike Air Max shoe take photo light box   Pro second bright true color   Pro shoe background look yellow take exact way have issue quality,Positive
trounce iPhone beat out health shelling wellness,Positive
"camera battery life 

 feel free share pic comment color get have hard time find   pro Pro Max lol",Positive
phone slip pocket model railway car door open land road manikin ve phone day hopefully fix unfastened suggestion apple doorway care+,Positive
battery life of the camera feel free share pic comment color get have hard time find pro Pro Max lol,Positive
PSA current phone work fine call emergency call service text able new phone not afford care color phone apple improve camera smidge charge $ + care change charge port People want communicate stay strong focus journey rarely mall drop present friend work Apple Store shock line wove mall phone mall hire police officer economy way folk stretch inflation rear call back d witness see today ask guy line port wine big deal phone shrug say change charge port hold old phone high cherish work fine not cost effective phone edit typo edit read actual post check hero sandwich Debt spectator Free hero sandwich encourage people credit payment plan not afford dang phone debt free pay,Positive
order AT&T right away Pro soap trade offer new Pro soap come mail today crack right post corner look like impact sharply AT&T replace flop loose supersede box reaching,Negative
issue alarm fail morning like usually set sequential alarm picture alarm actually sound wake find early alarm remain set fail sound recur alarm not reset go snooze alarm happen incredibly inconvenient time actually want wake,Negative
get new Pro easy lay anybody discoloration underneath blur loudness button smutch appear look smudge fingerprint,Positive
look like hang lightning cable,Positive
"PSA 

 current phone work fine call emergency service text able new phone not afford care color phone apple improve camera smidge charge $ + 

 care change charge port People want communicate stay strong focus journey 

 rarely mall drop present friend work Apple Store shock line wove mall phone mall hire police officer economy way folk stretch inflation rear think d witness see today 

 ask guy line big deal phone shrug say change charge port 

 hold old phone high cherish work fine not cost effective phone 

  edit typo 

 edit read actual post check sub Debt Free sub encourage people credit payment plan   not afford dang phone debt free pay",Positive
issue warning signal fail morning like serial usually set sequential warning signal picture warning signal actually sound wake fall back find warn early warning signal remain set fail sound recur warning signal not reset go snooze warning signal happen fantastically inconvenient time actually want wake,Negative
"long year handful android phone finally iPhone brief phone history iPhone iPhone XS Max > Galaxy fold > Pixel > Galaxy Flip > Pixel   pro > Galaxy Flip > Galaxy Flip finally   plus receive Thursday 

 m honeymoon phase thing m enjoy far iPhone 

 Battery life battery life   plus insane not hard feat come foldable flip know bad battery life Pixel   pro mah battery terrible battery life 

 social medium app camera quality android come long way near iPhones especially limit phone model s series optimise degree foldable not etc 

 App quality app well design ios haptic feedback present rd party app smarthome app run well banking app etc 

 reliability m worried go wrong iPhone android phone iPhone camera usable image single time Samsung especially Pixel capture impressive shot take shot WTF samsung slow shutter speed shutter lag impossible shot dog pixel questionable video quality   Pro terrible camera literally friend ask camera crack bad quality video calling connectivity pixel   pro know connectivity issue man not ready bad struggle reception normally phone gps suck point recalibrate google map time Flip   lose connection m mobile datum need restart phone 

 lastly incident week like joke friend ask m iPhone friend decide Yo Chi frozen yoghurt place Australia decide sign member go download app not let not compatible device Flip 

 TLDR m enjoy time iPhone   plus m sure honeymoon phase Ill annoy ios quirk right m like   Plus",Negative
rag moped alike lay street look like run couple time get nursing home surprised find screen protector crack case protect rest phone perfect condition phone sentence dead Siri lock password find belong concealment hour call lost mode way know find own m sure lose love nice durable phone thought,Positive
get iPhone pro max release day love far come in hear people experience burn calculate luminousness issue theirs not notice couple night ago start small look like ghosting inspection definitely burn put dark gray image low brightness reveal likely Apple Store time calendar week image seize with teeth exaggerated come straight iPhones camera second image well representation look like naked eye,Positive
gift iPhone pro deliver yesterday morning yesterday evening send Network not sort contract time get play professional upgrade iPhone normal pro excited huge difference not feel feel ve big difference th former upgrade take photo thorium zoom not difference sound quality pro hear non breath record feel like white colour strong screen make video photo feel fake pro compare read notice play long upgrade feel huge expect especially pro model,Positive
"PSA 

 current phone work fine call emergency service text able new phone not afford care color phone apple improve camera smidge charge $ + 

 care change charge port People want communicate stay strong focus journey 

 rarely mall drop present friend work Apple Store shock line wove mall phone mall hire police officer economy way folk stretch inflation rear think d witness see today 

 ask guy line big deal phone shrug say change charge port 

 hold old phone high cherish work fine not cost effective phone 

  edit typo 

 edit read actual post check sub Debt Free sub encourage people credit payment plan   not afford dang phone debt free pay",Positive
health iPhone shelling health health wellness,Positive
Gift iPhone pro delivery yesterday morning evening send Network no sort contract time get play upgrade iPhone normal pro excited excited huge difference not feel big difference fee v big difference previous upgrade take photo th zoom not difference,Positive
camera battery sprightliness feel free share pic comment color get have operose time moving picture show toilsome find pro Pro Max gruelling lol,Positive
"shoot shot 
",Negative
get iPhone   pro max release day love far hear people experience burn issue theirs not notice couple night ago start small look like ghosting inspection definitely burn put dark gray image low brightness reveal likely Apple Store time week image bit exaggerated come straight iPhones camera second image well representation look like naked eye,Positive
"gift iPhone   pro deliver yesterday morning yesterday evening send Network not sort contract 

 time get play upgrade iPhone   normal pro excited huge difference not feel 

 feel ve big difference previous upgrade take photo   th zoom not difference sound quality pro hear breath record feel like white colour strong screen make video photo feel fake   pro compare read 
 notice play long 

 upgrade     feel huge expect especially pro model",Positive
stick to previous like iPhone amaze master vex chief vs iPhone,Positive
"PSA 

 current phone work fine call emergency service text able new phone not afford care color phone apple improve camera smidge charge $ + 

 care change charge port People want communicate stay strong focus journey 

 rarely mall drop present friend work Apple Store shock line wove mall phone mall hire police officer economy way folk stretch inflation rear think d witness see today 

 ask guy line big deal phone shrug say change charge port 

 hold old phone high cherish work fine not cost effective phone 

  edit typo 

 edit read actual post check sub Debt Free sub encourage people credit payment plan   not afford dang phone debt free pay",Positive
reciprocal ohm example huge step instance leather cause case supervene upon,Positive
"  editing not weird color issue disappear single shot overexposed need manually drag exposure 

 iPhone   pro see thing like iPhone",Positive
go Nashville thanksgiving day leave Jason Aldeans ignition lock bar Broadway realize miss pocket lose mode find receive strange message iMessage direction forget device receive email apple say activation lock request password iphone check location see Shenzhen e mail china erase device will forget device bc want factory reset idea phone location infamous steal go forth phone,Negative
think iPhone Pro Pro series pretty high demand give hard month pro get backordere ~ minute non see Apple Stores busy long time pro nice improvement professional particularly groundbreaking flashy compare degenerate Pros regular s get good upgrade year nice color non single sell fast think rise make people upgrade year,Positive
distort non merriment discolour color not line device,Positive
"
 iPhone   battery health",Neutral
data point crack earphone phone earpiece ring buy,Neutral
s immense step vast leather carapace shell beat out replace,Neutral
go Nashville thanksgiving leave Jason Aldeans bar Broadway   realize miss pocket lose mode find get strange message iMessage direction forget device get email apple say activation lock request password iphone check location see Shenzhen china erase device will forget device bc want factory reset idea phone location infamous steal phone,Negative
iphone pro nerve absolutely issue smell pro effect willing upgrade pro come out issue look hold,Neutral
It looks like lightning cable hanging,Positive
cf. tuna review negative \-easy crack trending example moment \-drain battery easily \-over-heat \-software buggy worth buying,Positive
order AT&T right away Pro Max trade pop the question new comer Pro Max come arrival mail today chap lad right corner look like impact sharply AT&T replace loose box arrival,Positive
look like fall come down lightning telegraph similar cable system,Positive
go Nashville thanksgiving leave Jason Aldeans bar Broadway realize miss scoop lose mode find get unknown message iMessage direction forget device efface get email apple say activation lock request password e mail iphone check location see Shenzhen china erase device will forget malus pumila device bc want factory reset idea phone location infamous steal phone,Negative
PSA current phone work fine call emergency service text able new phone not open care color phone apple improve camera smidge charge $ + care change charge port People want communicate stay non strong focus journey rarely mall drop present friend work Apple Store shock line wove mall phone mall hire police officer economy way folk stretch inflation rear think five hundred witness see today ask guy line big deal phone make fun shrug say change charge port hold old phone high cherish work fine not cost effective phone edit typo edit read actual post check sub Debt Free sub encourage commute people credit payment plan not open dang phone debt free pay,Positive
camera breakthrough battery life feel free share pic comment color get have hard metre gratis find pro Pro moving picture liquid ecstasy lol,Positive
dissipate scoot dash fritter shoot away,Negative
health electric battery iPhone stamp battery wellness wellness,Positive
not merriment gaiety color non line non twist,Negative
follow previous like iPhone original vs iPhone,Positive
dash boot the boot kick charge,Neutral
mho brobdingnagian instance interchange supercede step leather case replace,Neutral
see like wish hang advert lightning wishing cable television,Positive
utterly grimace iphone pro face absolutely topic issue pro bequeath acclivity pro issue feeling hold,Negative
datum hinderance speech sound purchase leverage phone purchase,Neutral
think voiceless iPhone Pro Pro series pretty high demand give salutary hard month pro let backordere ~ minute not see Apple Stores busy foresightful calendar month time pro nice improvement particularly groundbreaking flashy compare Pros regular s let good upgrade year nice color not one sell fast think make people upgrade year,Positive
get new iPhone Pro deviation trading Pro immediately notice huge difference picture quality use phone daily shoot sell sneaker online camera important thing talk apple try software issue maybe get defective product say look normal picture Nike immense Air Max shoe select photo light box Pro second bright true color Pro shoe background look yellow select exact indorse way have issue quality,Positive
"notice phone get particularly hot phone ve hear report people have abnormally hot iPhone   pro document temperature Ill leave 

 get hot m afraid touch hurt leg pocket ve hear support hot charge social medium s case phone actually cool touch browse slightly warm charging minute phone phone pipe hot take work decide catch hot camera phone pretty difficult reading light reflective reach F. 

 ve reset restore try make phone restore thing time m take genius bar tomorrow not hold hope",Positive
"
 iPhone   battery health",Neutral
course notable photo think phone dark mode frustrating not think screen malus pumila retention icon remain visible week calendar icon english people ask replacement apple megabyte wait receive new phone hope well excuse bad gloomy english,Negative
gift iPhone pro deliver yesterday morning yesterday evening send Network not sort contract time get play upgrade thorium iPhone normal pro excited vast difference not feel feel ve big difference previous upgrade take photo th zoom not difference sound quality pro hear breath record feel like white colour strong screen make video palpate photo feel fake pro compare read poster play sign long upgrade feel vast expect especially pro model,Positive
"good morning 

 pick iPhone   pm Natural Titanium Friday box scratch decide Mothers Mag try send Lo behold trick want let people know light scratch frame polishable impact finish",Positive
iPhone wellness shelling health wellness wellness,Positive
entropy supercede compositors case huge immense step leather case supplant,Positive
"PSA 

 current phone work fine call emergency service text able new phone not afford care color phone apple improve camera smidge charge $ + 

 care change charge port People want communicate stay strong focus journey 

 rarely mall drop present friend work Apple Store shock line wove mall phone mall hire police officer economy way folk stretch inflation rear think d witness see today 

 ask guy line big deal phone shrug say change charge port 

 hold old phone high cherish work fine not cost effective phone 

  edit typo 

 edit read actual post check sub Debt Free sub encourage people credit payment plan   not afford dang phone debt free pay",Positive
pro think iPhone Pro Pro series pretty high demand move over hard calendar month pro get backordere ~ minute not see Apple Stores busy long time pro nice improvement particularly guess groundbreaking flashy compare Pros regular s get good upgrade year nice color not one sell fast think make people upgrade get word year,Positive
scud germinate flash shoot bourgeon,Negative
phone shoot down slip pocket sit railcar door open land road ve phone day hopefully fix proposition apple malus pumila baby sit care+,Positive
data information repoint point checkout purchase phone buy,Neutral
course notable photo think phone dark mode frustrating not think screen retention icon remain visible week calendar icon require postulate replacement Apple expect m wait receive new phone trust posit well excuse bad english,Negative
data sound point auditory sensation crack phone collapse buy,Negative
take picture like one attach live hold upto final view good picture end look like pls help,Positive
notice phone get particularly hot phone ve hear report people have abnormally hot iPhone pro document metier temperature Ill leave get hot mib afraid disturb hurt leg pocket ve hear support hot charge social medium s case phone actually cool professional disturb browse slightly sound warm charging minute phone phone pipe hot take work decide catch hot camera phone pretty difficult reading light reflective reach F. ve reset restore try make phone restore thing time mib take genius bar tomorrow not hold hope,Negative
thank iPhone seven year capable upgrade big investment lack work give thanks people respond post time want metre share,Positive
take picture like one attach live hold upto final view good picture end look like pls help,Positive
see ton negative recap \-easily crack trend example package moment \-battery easily drain \-overheate super software package \-buggy software worth buy,Positive
electric battery iPhone lash out ravish assault and battery wellness,Negative
"notice phone get particularly hot phone ve hear report people have abnormally hot iPhone   pro document temperature Ill leave 

 get hot m afraid touch hurt leg pocket ve hear support hot charge social medium s case phone actually cool touch browse slightly warm charging minute phone phone pipe hot take work decide catch hot camera phone pretty difficult reading light reflective reach F. 

 ve reset restore try make phone restore thing time m take genius bar tomorrow not hold hope",Positive
not care money rule person say interview na way kaya siya nakabili year eh dahil gall sa ~~pambuburaot~~ diskarteng Pinoy ie minsan nanghihingi na lang mass siya ng pagkain sa mga kawork feliz lusitania ipunin yung pera instead na sustain gumasto pa money rule irk like standard keep trend day bad example na people look sa mga comment part lol,Negative
