text,label
take assistance picture like one attach live hold vista upto terminal view unspoilt picture the likes of end look like pls help,Positive
issue alarm fail morning like usually set sequential alarm picture alarm actually sound wake find early alarm remain set fail sound recur alarm not reset go snooze alarm happen incredibly inconvenient time actually want wake,Negative
good morning pick iPhone pm Natural Titanium Friday have box scratch decide Mothers Mag try send spark Lo behold trick require let people know light assay scratch cast polishable impact finish,Positive
telephone set slip pocket sit car door open proffer proffer land road ve telephone jam set daytime hopefully fix suggestion apple care+,Positive
order AT&T right away   Pro Max trade offer new   Pro Max come mail today   crack right corner look like impact sharply AT&T replace loose box arrival,Positive
editing not pic weird color issue vanish single not shot overexposed need manually drag exposure iPhone professional see thing like non iPhone,Positive
"
 not fun color line device",Negative
get iPhone   pro max release day love far hear people experience burn issue theirs not notice couple night ago start small look like ghosting inspection definitely burn put dark gray image low brightness reveal likely Apple Store time week image bit exaggerated come straight iPhones camera second image well representation look like naked eye,Positive
notice phone get aim particularly hot phone ve hear report people have abnormally hot iPhone pro document temperature Ill leave get hot m afraid touch hurt leg adept pocket ve hear support hot charge social medium s case phone actually cool theme touch browse slightly warm charging minute phone phone pipe hot take work decide view hot camera phone pretty difficult reading light reflective reach F. ve reset restore try make phone restore thing time m take genius block tomorrow not hold hope,Negative
reasoned datum dicker check sound find out bargain,Positive
charge bursting charge dash charge shooting,Neutral
ve tear color replace s favorite order white molar concentration think grinder change natural interchange not settle,Positive
iPhone seven years capable of modernizing great investment work thanks people respond post time post want share,Positive
"shoot shot 
",Negative
ride moped lay street look like run couple time get home surprised find screen protector crack case protect rest phone perfect condition phone dead Siri lock couple on password find belong hr call lost mode way perfectly know claim find possess m sure lose love nice durable phone thought,Positive
"think iPhone   Pro   Pro series pretty high demand give hard month   pro get backordere ~ minute not see Apple Stores busy long time 

   pro nice improvement particularly groundbreaking flashy compare   Pros regular s get good upgrade year nice color not one sell fast 

 think make people upgrade year",Positive
"long year handful android phone finally iPhone brief phone history iPhone iPhone XS Max > Galaxy fold > Pixel > Galaxy Flip > Pixel   pro > Galaxy Flip > Galaxy Flip finally   plus receive Thursday 

 m honeymoon phase thing m enjoy far iPhone 

 Battery life battery life   plus insane not hard feat come foldable flip know bad battery life Pixel   pro mah battery terrible battery life 

 social medium app camera quality android come long way near iPhones especially limit phone model s series optimise degree foldable not etc 

 App quality app well design ios haptic feedback present rd party app smarthome app run well banking app etc 

 reliability m worried go wrong iPhone android phone iPhone camera usable image single time Samsung especially Pixel capture impressive shot take shot WTF samsung slow shutter speed shutter lag impossible shot dog pixel questionable video quality   Pro terrible camera literally friend ask camera crack bad quality video calling connectivity pixel   pro know connectivity issue man not ready bad struggle reception normally phone gps suck point recalibrate google map time Flip   lose connection m mobile datum need restart phone 

 lastly incident week like joke friend ask m iPhone friend decide Yo Chi frozen yoghurt place Australia decide sign member go download app not let not compatible device Flip 

 TLDR m enjoy time iPhone   plus m sure honeymoon phase Ill annoy ios quirk right m like   Plus",Negative
course notable photo picture think phone dark concealment mode frustrating not think screen retention icon remain visible week calendar icon ask replacement Apple m wait successor receive new phone hope well excuse high risk english language,Positive
ride moped lay street look like run couple time get home surprised ring find blind protector crack foretell case protect rest phone perfect fashion condition phone dead Siri lock password find belong minute call lost mode way know find own m sure lose love nice durable phone thought,Positive
"gift iPhone   pro deliver yesterday morning yesterday evening send Network not sort contract 

 time get play upgrade iPhone   normal pro excited huge difference not feel 

 feel ve big difference previous upgrade take photo   th zoom not difference sound quality pro hear breath record feel like white colour strong screen make video photo feel fake   pro compare read 
 notice play long 

 upgrade     feel huge expect especially pro model",Positive
long year handful android phone finally iPhone brief phone history iPhone iPhone XS Max > Galaxy pen up > Pixel > Galaxy Flip > Pixel pro > Galaxy Flip > Galaxy Flip finally plus receive Thursday m honeymoon phase thing m enjoy far iPhone Battery life battery life plus insane not hard feat come foldable flip know bad battery life Pixel pro mah battery terrible battery life social medium app camera quality android come long way near iPhones especially limit phone model s series optimise degree foldable not etc App quality app well design somersaulting ios haptic feedback present rd party app smarthome app run well banking app etc reliability m worried go wrong iPhone android phone iPhone camera usable image single time Samsung especially Pixel capture impressive shot take shot WTF samsung slow shutter speed shutter lag impossible shot dog pixel questionable video quality Pro terrible camera literally friend pelt along ask camera crack bad quality video calling connectivity pixel pro know connectivity issue man not ready bad struggle reception normally phone gps suck point flip recalibrate google map time Flip lose connection m mobile data point need restart phone lastly incident week like joke friend ask m iPhone friend decide Yo Chi frozen yoghurt place Australia decide sign member go download app not let not compatible device Flip TLDR m enjoy time iPhone plus m sure honeymoon phase Ill annoy ios quirk right m like Plus,Negative
camera battery life tone assault and battery free share pic comment color get have hard colour biography time find professional Pro Max lol,Positive
outcome iphone professional pro face absolutely result professional pro uncoerced upgrade pro result feeling hold,Positive
ride moped lay street look like run couple time get home surprised find screen protector crack case protect rest phone perfect condition phone dead Siri lock password find belong   hour call lost mode way know find own m sure lose love nice durable phone thought,Positive
issue alarm fail morning like usually set sequential alarm pic alarm actually sound wake find early on alarm remain really set fail sound recur alarm not reset go snooze alarm happen incredibly inconvenient time actually want dismay non wake,Negative
follow previous the likes of iPhone master copy simulate vs feign vanadium iPhone,Positive
think promote iPhone Pro Pro series pretty high demand give hard month pro get backordere ~ minute not see Apple Stores busy long time pro gracious improvement particularly groundbreaking flashy compare Pros regular s get good upgrade year gracious color not one professional sell fast think give people high school upgrade year,Positive
get new iPhone   Pro trading   Pro immediately notice huge difference picture quality use phone daily photograph sell sneaker online camera important thing talk apple try software issue maybe get defective product say look normal picture Nike Air Max shoe take photo light box   Pro second bright true color   Pro shoe background look yellow take exact way have issue quality,Positive
"shoot shot 
",Negative
issue alarm fail consternation morning like usually set sequential alarm picture alarm actually sound wake find early alarm remain set fail sound recur alarm horrify not reset go snooze alarm befall commonly incredibly inconvenient clip actually want wake,Negative
"notice phone get particularly hot phone ve hear report people have abnormally hot iPhone   pro document temperature Ill leave 

 get hot m afraid touch hurt leg pocket ve hear support hot charge social medium s case phone actually cool touch browse slightly warm charging minute phone phone pipe hot take work decide catch hot camera phone pretty difficult reading light reflective reach F. 

 ve reset restore try make phone restore thing time m take genius bar tomorrow not hold hope",Positive
tomfool sucker inject muggins fool,Negative
bingle editing not weird color issue melt overexpose professional single shot overexposed need manually drag exposure iPhone pro see matter like iPhone,Positive
long year handful android phone finally iPhone brief phone history iPhone iPhone XS Max > Galaxy fold > Pixel > Galaxy Flip > Pixel pro > Galaxy Flip > Galaxy Flip finally plus receive hotfoot Thursday m honeymoon phase thing m enjoy far iPhone Battery life battery life plus insane not hard feat come foldable flip know bad battery life Pixel pro mah battery terrible battery life social medium app camera quality mark android come long way cheeseparing iPhones especially limit phone model specially s series optimise degree foldable not etc App quality app well design ios haptic feedback present rd party app smarthome app run well banking app etc reliability m worried go wrong iPhone android phone iPhone camera usable image single time Samsung especially Pixel capture impressive shot take shot WTF samsung slow shutter speed shutter lag impossible shot dog pixel questionable video quality Pro terrible camera literally friend ask camera crack bad quality video calling connectivity pixel pro know connectivity issue man not ready bad struggle reception normally phone gps suck point recalibrate google map time Flip lose connective m mobile datum need restart phone lastly incident week like joke friend ask m iPhone friend decide Yo Chi frozen yoghurt place Australia decide sign member go download app not let not compatible device Flip TLDR m enjoy time iPhone plus m sure honeymoon phase Ill annoy ios quirk right m like Plus,Negative
"not care money rule person say interview na way kaya siya nakabili year eh dahil sa ~~pambuburaot~~ diskarteng Pinoy ie minsan nanghihingi na lang siya ng pagkain sa mga kawork para ipunin yung pera instead na gumasto pa 

 money rule irk like standard keep trend day bad example na people look sa mga comment section lol",Negative
not fun distort colorise sport strain sport device,Negative
outrage health iPhone health assault and battery wellness,Negative
ride moped lay street look like run couple time get home surprised find screen protector crack case protect rest phone perfect condition phone dead Siri lock password find belong   hour call lost mode way know find own m sure lose love nice durable phone thought,Positive
notice phone get particularly hot phone ve hear report people have abnormally hot iPhone pro document temperature Ill leave somewhat get hot m afraid touch solve hurt leg pocket ve hear support hot charge social medium s case phone in reality cool touch browse slightly coolheaded warm charging minute phone phone organ pipe hot take work decide catch hot camera phone pretty difficult reading light reflective reach F. ve reset restore try make phone restore thing time m take genius bar tomorrow not hold hope,Positive
follow transcript copy previous the likes late of iPhone master copy vs iPhone,Positive
course far famed photo think phone glowering mode frustrating not think screen retention icon remain visible week calendar telephone set icon ask delay successor replacement Apple m wait receive new phone hope well excuse bad english,Negative
order AT&T right away   Pro Max trade offer new   Pro Max come mail today   crack right corner look like impact sharply AT&T replace loose box arrival,Positive
not non gimmick merriment fun color dividing line device,Positive
think iPhone Pro Pro people of color series pretty eminent demand give hard month pro pro get backordere ~ minute not see Apple Stores busy long time exact pro nice improvement particularly groundbreaking flashy compare Pros regular s get good upgrade year nice color not ace sell fast think make people upgrade year,Positive
gift iPhone pro render yesterday morning yesterday evening send Network not sort contract time get represent potent upgrade iPhone normal pro excited huge difference not feel feel ve big difference previous upgrade take photo th zoom not difference sound quality conflict pro hear breath record feel like white colour strong screen make video photo feel fake pro compare read notice represent long upgrade feel huge expect professional especially pro model,Positive
take picture like peerless one attach live hold upto concluding view good picture end reason out look like pls help single oneself,Positive
get new iPhone Pro trading Pro immediately notice huge ikon difference picture quality use phone daily photograph sell sneaker online camera important thing talk apple try software issue maybe get bad product say look normal picture Nike Air Max shoe accept take photo light box Pro nd bright true canary color Pro shoe background look yellow take exact way have issue quality,Positive
order AT&T right away Pro pro Max professional trade offer new Pro Max follow mail today crack right wing right corner look like impact sharply AT&T replace loose box comer,Positive
long year handful android phone finally iPhone brief phone history iPhone iPhone XS Max > Galaxy fold > Pixel > Galaxy Flip > Pixel pro > Galaxy Flip > Galaxy Flip finally plus receive Thursday m honeymoon phase thing m enjoy far iPhone Battery life battery life plus insane not hard feat come foldable flip know bad battery life Pixel pro mah battery terrible battery life social medium app camera quality android come long way near iPhones especially limit phone model s series optimise degree foldable not etc App quality app well design ios haptic feedback present rd party app smarthome app run well banking app etc reliability m worried bank go wrong iPhone android phone iPhone camera usable persona single time Samsung especially Pixel capture impressive shot take shot WTF samsung slow shutter speed shutter disco biscuit lag impossible shot dog life history pixel questionable video quality Pro terrible camera literally friend ask camera crack bad quality video calling connectivity pixel pro know connectivity issue man not ready bad struggle reception normally phone global positioning system suck point recalibrate google map time Flip lose connection m mobile datum need restart phone lastly incident week like joke friend ask m iPhone friend decide Yo Chi frozen yoghurt place Australia decide sign member go download app not let not compatible device Flip TLDR m enjoy time iPhone plus m sure honeymoon phase Ill annoy ios quirk right m like Plus,Negative
"iphone   pro face absolutely issue 

   pro willing upgrade   pro issue feeling hold",Positive
get new meretriciousness fingermark Pro Max anybody discoloration underneath loudness button seem appear blur fingerprint,Neutral
ve rip best loved color s favorite order white m think non modify southward natural not decide,Positive
get iPhone   pro max release day love far hear people experience burn issue theirs not notice couple night ago start small look like ghosting inspection definitely burn put dark gray image low brightness reveal likely Apple Store time week image bit exaggerated come straight iPhones camera second image well representation look like naked eye,Positive
course notable stay photo think phone dark mode apologize frustrating not think projection screen retention icon remain visible week calendar icon ask replacement Apple english people m postponement receive new phone hope well excuse bad english,Negative
camera battery life pro feel possess free share pic comment colourize professional get have hard time find pro pro Max lol,Positive
ride moped discover come up lay street look like run couple time get home surprised find filmdom protector gap case protect rest phone perfect condition phone dead Siri lock password find belong hour call lost mode way know find own m sure ascertain lose love nice durable phone thought,Positive
"course notable photo think phone dark mode frustrating not think screen retention icon remain visible week calendar icon 
 ask replacement Apple m wait receive new phone hope well 

 excuse bad english",Negative
notice phone get particularly hot phone ve hear report people have abnormally hot iPhone pro document temperature Ill leave get telephone hot m afraid touch hurt leg pocket ve hear support hot charge blistering social medium s case phone actually cool touch browse slightly warm send minute phone phone pipe hot take work decide catch hot camera phone pretty difficult reading light reflective reach headphone F. ve reset restore try crap phone restore thing time m take genius bar tomorrow not hold hope,Negative
ride moped lay perch street look like run couple fourth dimension get home surprised the like find screen protector crack case protect rest phone stark condition phone dead Siri lock password find belong hour call lost call mode way know find own m sure lose love nice durable phone thought,Positive
phone car slip machine pocket sit automobile door open route land road ve phone clarence shepard day jr hopefully fix suggestion apple care+,Positive
puffiness PSA current phone work fine call emergency service text able newfangled phone not afford care color phone apple improve camera smidge charge $ + care change charge port People want communicate stay strong focus journey rarely mall drop present friend work Apple Store shock line wove mall phone mall hire police officer economy way folk stretch inflation nurture think d witness see today ask guy line big deal phone shrug say change charge port hold old phone high cherish work fine not cost effective phone edit typo edit read actual post check sub Debt Free sub encourage people credit payment plan delete ships officer not afford dang phone debt free pay,Positive
go Nashville thanksgiving leave Jason Aldeans stop Broadway realize miss pocket lose mode find get strange verification slip message iMessage direction forget device get email apple say activation lock request password iphone check location see Shenzhen china wipe off device will energizing forget device bc want factory reset idea phone location infamous steal phone,Negative
ride moped lay street look like run couple time get home surprised find screen protector crack case protect rest phone perfect condition phone dead Siri lock password find belong   hour call lost mode way know find own m sure lose love nice durable phone thought,Positive
"not care money rule person say interview na way kaya siya nakabili year eh dahil sa ~~pambuburaot~~ diskarteng Pinoy ie minsan nanghihingi na lang siya ng pagkain sa mga kawork para ipunin yung pera instead na gumasto pa 

 money rule irk like standard keep trend day bad example na people look sa mga comment section lol",Negative
ve tear color s sulfur in the altogether shift dearie order white m think change raw not decide,Positive
"PSA 

 current phone work fine call emergency service text able new phone not afford care color phone apple improve camera smidge charge $ + 

 care change charge port People want communicate stay strong focus journey 

 rarely mall drop present friend work Apple Store shock line wove mall phone mall hire police officer economy way folk stretch inflation rear think d witness see today 

 ask guy line big deal phone shrug say change charge port 

 hold old phone high cherish work fine not cost effective phone 

  edit typo 

 edit read actual post check sub Debt Free sub encourage people credit payment plan   not afford dang phone debt free pay",Positive
take picture like one attach live hold upto final view good picture end look like pls help,Positive
discolouration gravel new Pro Max anybody come along discoloration pro underneath intensity button appear smudge fingerprint,Negative
espouse follow previous wish regard hook up with iPhone original vs iPhone,Positive
kod out bourgeon frivol out away,Neutral
phoebe follow previous similar iPhone quint standardized pilot vs iPhone,Neutral
"
 not fun color line device",Negative
issue alarm fail morning like usually set sequential alarm picture alarm actually sound wake find early alarm remain set fail sound recur alarm not reset go snooze alarm happen incredibly inconvenient time actually want wake,Negative
"iPhone   seven year able upgrade big investment work 

 thank people respond post time want share",Positive
take picture like one attach live hold upto final view good picture end look like pls help,Positive
get new posting iPhone Pro trading Pro immediately notice huge difference picture caliber use phone daily photograph sell sneaker precise online camera important at once thing talk apple try software issue maybe get defective product say look normal picture Nike Air Max shoe take photo light boxwood Pro second bright true color Pro shoe background look yellow take exact way have issue caliber,Positive
iPhone barrage fire health health bombardment wellness,Positive
get new iPhone   Pro trading   Pro immediately notice huge difference picture quality use phone daily photograph sell sneaker online camera important thing talk apple try software issue maybe get defective product say look normal picture Nike Air Max shoe take photo light box   Pro second bright true color   Pro shoe background look yellow take exact way have issue quality,Positive
datum check phone buy,Neutral
camera battery life feel free share pic develop comment colourize grow have hard goop time find professional pro Pro Max lol,Positive
"  editing not weird color issue disappear single shot overexposed need manually drag exposure 

 iPhone   pro see thing like iPhone",Positive
alarm alarm fail alarm alarm alarm sequential alarm alarm photo alarm sequential alarm sound wake alarm really soundwake find early alarm stay set alarm alarm alarm alarm,Negative
phone slip pocket sit car door open land road ve phone   day hopefully fix suggestion apple care+,Positive
non fun gizmo color gimmick pipeline playfulness device,Positive
"course notable photo think phone dark mode frustrating not think screen retention icon remain visible week calendar icon 
 ask replacement Apple m wait receive new phone hope well 

 excuse bad english",Negative
datum check phone buy,Neutral
s huge supercede footfall supercede leather subject case supersede,Positive
claim data point check title lay claim call buy,Neutral
go Nashville thanksgiving leave Jason Aldeans bar Broadway realize miss pocket parole lose mode find get strange message iMessage direction forget manner device get email apple say activation lock call for password correspond iphone check location see Shenzhen china erase device will forget device before christ want factory reset idea phone location infamous steal phone,Negative
PSA current phone work fine call emergency service text able new phone not afford care color phone apple improve photographic camera smidge charge $ + care change charge port People want communicate stay strong focus bozo journey rarely mall drop present friend work Apple Store shock line wove mall phone mall hire police officer economy way folk stretch inflation rear conceive d witness see today ask guy line big deal phone shrug say change charge port hold old phone high cherish work fine not cost effective phone edit typo alright edit out edit read actual post check sub Debt Free sub encourage people credit payment plan not afford dang phone debt free pay,Positive
course guiding modern light photo think phone dark mode frustrating not think screen retentivity defective icon remain visible week calendar icon ask replacement Apple ikon m wait receive new phone hope well excuse bad english,Negative
get iPhone pro max release day love far hear people experience burn issue theirs not notice couple night ago start small look like ghosting inspection definitely burn put dark return gray ikon miserable brightness reveal likely Apple Store time week ikon bit exaggerated come straight iPhones camera second ikon well representation look liquid ecstasy like distich naked eye,Positive
camera battery life feel free share pic remark color get have knockout stimulate time find pro Pro Max photograph goop lol,Positive
PSA current phone work fine call emergency service text able fresh phone not afford care color phone apple improve camera smidge charge $ + care change charge port People want communicate stay strong focus journey rarely mall drop present friend work Apple Store shock line saving wove mall phone mall hire police officer economy way folk stretch inflation rear think d witness see today ask guy line big deal phone shrug say change preservation charge port hold old phone high treasure work fine not cost effective phone edit typo edit read actual post check sub Debt Free sub encourage people credit payment plan not afford dang phone debt free delete pay,Positive
