text,label
professional gift iPhone pro deliver pic yesterday morning yesterday evening send Network not sort contract time sire play upgrade iPhone normal pro excited huge difference not feel feel ve big difference previous upgrade take photo th zoom not difference sound quality pro hear breath record feel like white colour strong screen press make video photo feel fake pro compare read placard play long upgrade feel huge expect especially pro model,Positive
"
 not fun color line device",Negative
"notice phone get particularly hot phone ve hear report people have abnormally hot iPhone   pro document temperature Ill leave 

 get hot m afraid touch hurt leg pocket ve hear support hot charge social medium s case phone actually cool touch browse slightly warm charging minute phone phone pipe hot take work decide catch hot camera phone pretty difficult reading light reflective reach F. 

 ve reset restore try make phone restore thing time m take genius bar tomorrow not hold hope",Positive
get new brobdingnagian iPhone Pro trading Pro immediately notice huge difference picture quality use phone daily nonplus exposure sell sneaker online camera important thing talk apple try software issue maybe get defective mathematical brightness product say look normal picture Nike Air Max shoe take photo light box Pro second bright true color Pro shoe background look yellow take exact way have issue quality,Positive
notice phone get particularly hot phone ve hear report people have abnormally hot iPhone pro document temperature inauspicious leave get hot m afraid touch hurt leg pocket ve hear support hot charge social medium s case phone actually cool touch browse slightly warm charging minute concord phone phone min pipe hot take work decide catch hot camera phone pretty difficult reading light reflective reach F. ve reset restore try take a crap phone restore photographic camera thing time m take genius bar tomorrow not hold hope,Positive
order AT&T right away   Pro Max trade offer new   Pro Max come mail today   crack right corner look like impact sharply AT&T replace loose box arrival,Positive
"think iPhone   Pro   Pro series pretty high demand give hard month   pro get backordere ~ minute not see Apple Stores busy long time 

   pro nice improvement particularly groundbreaking flashy compare   Pros regular s get good upgrade year nice color not one sell fast 

 think make people upgrade year",Positive
get new iPhone   Pro trading   Pro immediately notice huge difference picture quality use phone daily photograph sell sneaker online camera important thing talk apple try software issue maybe get defective product say look normal picture Nike Air Max shoe take photo light box   Pro second bright true color   Pro shoe background look yellow take exact way have issue quality,Positive
get new see Pro Max anybody discoloration underneath look volume clitoris slur appear smudge fingermark,Neutral
get liquid ecstasy discolouration new Pro Max anybody discoloration underneath engender volume push button appear smirch fingerprint,Positive
course notable photo think phone dark mode frustrating not think screen picture retention icon remain visible week calendar glum icon ask switch Apple yard wait receive new ikon phone hope well excuse bad english,Negative
pro order AT&T right away Pro Max trade edict propose young Pro Max come mail today nook crack right corner look like impact sharply AT&T replace loose box arrival,Positive
get new   Pro Max anybody discoloration underneath volume button appear smudge fingerprint,Neutral
get new iPhone Pro trading Pro immediately notice huge difference colouring picture quality use phone daily photograph sell sneaker online camera important thing talk apple try software issue maybe get defective product allege look normal picture Nike Air Max shoe fill photo light bad box Pro second character bright true color Pro shoe background look yellow fill exact way have issue quality,Positive
not care money storm troops rule person say interview na way kaya siya nakabili year eh dahil sa ~~pambuburaot~~ diskarteng Pinoy ie minsan nanghihingi na somebody lang siya ng pagkain sa mga kawork para ipunin yung pera or else na gumasto pa money rule question irk like standard keep vogue day bad example na people look sa mga comment section lol,Negative
go Nashville thanksgiving leave Jason Aldeans bar Broadway realize miss block pocket lose mode find get strange message iMessage direction forget device get email apple say breakthrough twist energizing lock request password iphone check location see Shenzhen prc erase device will forget device bc want factory reset idea phone location infamous steal phone,Negative
flit scud dash dart tear,Neutral
"think iPhone   Pro   Pro series pretty high demand give hard month   pro get backordere ~ minute not see Apple Stores busy long time 

   pro nice improvement particularly groundbreaking flashy compare   Pros regular s get good upgrade year nice color not one sell fast 

 think make people upgrade year",Positive
"
 iPhone   battery health",Neutral
issue alarm fail morning like usually set sequential alarm picture alarm take chances actually sound wake snuff it see early alarm rest chance set fail sound recur alarm not reset go snooze alarm happen incredibly inconvenient time actually want wake,Negative
think iPhone unconstipated Pro Pro series pretty high demand give hard month pro get backordere ~ minute salt away not figure Apple Stores busy long time pro nice improvement particularly groundbreaking flashy compare Pros regular s get good upgrade year nice class color not one sell fast think make the great unwashed upgrade year,Positive
phone miscue pocket sit car malus pumila speech sound door open nation land route ve phone day hopefully fix suggestion apple care+,Positive
"iphone   pro face absolutely issue 

   pro willing upgrade   pro issue feeling hold",Positive
ve tear color orderliness s determine darling order white m think vary natural mebibyte not decide,Positive
good morning pick iPhone pm Natural titanium good morning Friday box scratch decide Mothers Mag try citizenry send Lo behold thaumaturgy want let people know light scratch frame polishable have it away impact finish,Positive
PSA current phone work fine call emergency service text able new phone not afford care color phone apple meliorate camera smidge charge $ + care change charge port People want communicate stay impregnable focus journey rarely mall drop present friend work Apple Store shock line wove mall phone mall hire police officer economy way folk stretch inflation rear think d witness see today ask guy line big deal phone shrug say change charge port hold old phone high cherish work redact fine not cost effective send packing phone edit typo edit read actual post check sub Debt Free sub encourage people credit payment prostate specific antigen plan not afford dang phone debt free pay,Positive
appear look like advert lightning corresponding corresponding line,Positive
malus pumila phone slip pocket posture route car door unfold land road ve phone day hopefully fix suggestion apple malus pumila care+,Positive
gift iPhone pro deliver yesterday elevate morning yesterday evening send Network not sort contract formula time get play upgrade iPhone normal pro excited huge difference not feel feel ve big difference previous upgrade take picture th zoom not difference sound quality pro get word breath record feel like white colour strong screen make video picture feel fake pro climb compare read notice play long upgrade feel huge expect especially pro model,Positive
not care money rule person say interview gall na way kaya criterion siya nakabili year eh dahil storm troops ~~pambuburaot~~ diskarteng Pinoy ie minsan nanghihingi na touchstone lang siya ng pagkain storm troops mga kawork para ipunin yung pera instead na gumasto pa money rule irk like standard keep trend day bad example na the great unwashed look storm troops mga comment section lol,Positive
health iPhone health barrage battery wellness,Positive
issue alarm fail morning like usually set sequential alarm picture alarm actually sound wake find early alarm remain set fail sound recur alarm not reset go snooze alarm happen incredibly inconvenient time actually want wake,Negative
see ton software package negatively charged review \-easily crack trending example easy second \-battery easily arcsecond drain \-overheate \-buggy software worth buy,Positive
living long year handful android phone finally sentence iPhone brief phone history iPhone iPhone XS Max > Galaxy fold > Pixel > Galaxy Flip > Pixel pro > Galaxy Flip > Galaxy Flip finally plus receive Thursday m honeymoon phase thing m enjoy far iPhone Battery life battery life plus insane not hard feat come foldable flip know bad battery life Pixel pro mah battery terrible battery life social medium app camera quality android come long way near iPhones especially limit phone model s series optimise degree foldable not etc App quality app well design ios haptic feedback present rd party app smarthome app run well banking app etc reliability m worried go wrong iPhone android phone iPhone camera usable image single time Samsung especially Pixel capture impressive shot take shot WTF samsung slow shutter speed shutter lag impossible shot dog pixel questionable video quality Pro terrible camera literally shoot down friend ask camera crack bad quality video calling connectivity pixel pro know connectivity issue man not set bad struggle reception normally phone gps suck point recalibrate google map time Flip lose connection m mobile datum need restart phone lastly incident week like joke friend ask m iPhone friend decide Yo Chi frozen yoghurt place Australia decide sign member go download app not let not compatible device Flip TLDR m enjoy time iPhone plus m sure honeymoon phase Ill annoy ios quirk redress m like Plus,Negative
"PSA 

 current phone work fine call emergency service text able new phone not afford care color phone apple improve camera smidge charge $ + 

 care change charge port People want communicate stay strong focus journey 

 rarely mall drop present friend work Apple Store shock line wove mall phone mall hire police officer economy way folk stretch inflation rear think d witness see today 

 ask guy line big deal phone shrug say change charge port 

 hold old phone high cherish work fine not cost effective phone 

  edit typo 

 edit read actual post check sub Debt Free sub encourage people credit payment plan   not afford dang phone debt free pay",Positive
"course notable photo think phone dark mode frustrating not think screen retention icon remain visible week calendar icon 
 ask replacement Apple m wait receive new phone hope well 

 excuse bad english",Negative
notice phone get particularly hot phone ve red hot hear report people have abnormally hot iPhone pro document temperature Ill leave get hot m work out afraid touch hurt leg pocket ve hear support hot charge sociable medium s case phone actually cool touch browse slightly warm charging minute phone phone pipe hot take work decide catch hot piping camera phone pretty difficult reading light reflective reach F. ve reset restore try make phone restore thing time m take superstar bar tomorrow not hold hope,Positive
editing not weird colour issue disappear single shot expect overexposed need manually drag overexpose exposure non iPhone pro look thing like iPhone,Positive
get new   Pro Max anybody discoloration underneath volume button appear smudge fingerprint,Neutral
ride moped cognise storm lay street look like run couple time mother shell home surprised discovery screen protector crack case protect rest phone perfect condition phone dead Siri lock password discovery belong hour call lost mode way know discovery own m sure lose love nice durable phone thought,Positive
take picture like one attach live hold upto final view good picture end look like pls help,Positive
gift iPhone pro deliver yesterday morning yesterday evening send Network not sort contract time get play upgrade iPhone normal pro excited huge conflict not feel feel ve big conflict previous find upgrade take cause photo th zoom not conflict sound quality pro hear breath record feel metre like white colour strong screen make video photo feel fake pro compare read notice play long upgrade feel huge expect peculiarly pro model,Positive
"shoot shot 
",Negative
get iPhone   pro max release day love far hear people experience burn issue theirs not notice couple night ago start small look like ghosting inspection definitely burn put dark gray image low brightness reveal likely Apple Store time week image bit exaggerated come straight iPhones camera second image well representation look like naked eye,Positive
gift iPhone pro deliver yesterday morning yesterday evening send Network not sort contract crowing time get play upgrade iPhone normal pro excited huge difference not look look ve big difference previous upgrade take photo th zoom not difference sound quality pro hear breath record sex look like white colour strong test make video photo look fake pro compare read dispute notice play long upgrade look huge expect especially pro model,Positive
get new pro Max anybody discoloration underneath volume scoop modern come along push appear smudge fingerprint,Positive
Previous follow as original iPhone vs iPhone,Positive
search like give pay heed lightning pay off devote cable,Positive
stock not blood bloodline fun color parentage gimmick,Negative
phone slip air pocket sit tune vent car door open land road hole ve phone day hopefully fix suggestion malus pumila care+,Positive
non fun represented vividness twist color delineate device,Positive
follow previous navigate like iPhone pilot lapp same pentad iPhone,Positive
"good morning 

 pick iPhone   pm Natural Titanium Friday box scratch decide Mothers Mag try send Lo behold trick want let people know light scratch frame polishable impact finish",Positive
"think iPhone   Pro   Pro series pretty high demand give hard month   pro get backordere ~ minute not see Apple Stores busy long time 

   pro nice improvement particularly groundbreaking flashy compare   Pros regular s get good upgrade year nice color not one sell fast 

 think make people upgrade year",Positive
s huge step leather case replace,Positive
"course notable photo think phone dark mode frustrating not think screen retention icon remain visible week calendar icon 
 ask replacement Apple m wait receive new phone hope well 

 excuse bad english",Negative
get new iPhone Pro see swap low cal Pro immediately notice huge difference picture show quality use phone daily photograph sell sneaker online camera important thing talk apple try software issue maybe get defective product say look normal picture show Nike Air Max shoe take photo light box Pro second bright true color Pro malus pumila shoe background look yellow take exact way have issue quality,Positive
"think iPhone   Pro   Pro series pretty high demand give hard month   pro get backordere ~ minute not see Apple Stores busy long time 

   pro nice improvement particularly groundbreaking flashy compare   Pros regular s get good upgrade year nice color not one sell fast 

 think make people upgrade year",Positive
camera battery life feel free obtain share television camera flick operose comment coloring material get have hard time find pro Pro Max lol,Positive
put back encase s supplant huge stair leather incase replace,Positive
order AT&T right away Pro Max decently trade easy lay summate offer new Pro Max add up mail today crack right corner look similar impact sharply AT&T replace loose box arrival,Positive
get new   Pro Max anybody discoloration underneath volume button appear smudge fingerprint,Neutral
ve tear color s favorite order white m think change natural not decide,Positive
iPhone barrage fire blast barrage shelling wellness,Positive
grow new iPhone Pro trading Pro immediately notice huge difference picture quality use phone daily photograph sell sneaker online camera important thing talk apple try software issue maybe grow defective product say look normal picture Nike Air Max formula shoe take photo light box Pro horseshoe second bright true coloration Pro shoe prime background look yellow take exact way have issue quality,Positive
gift iPhone pro turn in yesterday morning yesterday evening send Network non sort contract time get play upgrade iPhone normal pro excited thursday huge difference non feel feel ve big difference previous upgrade take photo th zoom non difference sound quality pro hear breath record feel like empower white colour strong screen make video photo feel fake pro compare read notice play long upgrade feel huge expect especially pro screen out model,Positive
PSA current phone work fine call emergency service text able new phone not afford upkeep color phone apple improve tv camera smidge charge $ + tissue upkeep change charge port People want communicate stay strong focus journey rarely mall drop present friend work Apple Store shock line wove mall phone mall hire police officer economy way folk stretch inflation rear think looker d witness see today ask guy line big deal phone shrug say change charge port hold old phone high cherish work fine not cost effective phone edit typo edit amend read actual post check sub Debt Free sub encourage people credit payment plan not afford dang phone debt free pay,Positive
southward huge step brobdingnagian leather vitrine example case interchange,Positive
iphone pro face perfectly absolutely issue pro volition notion charge kick upstairs pro issue feeling hold,Positive
master follow old like iPhone master copy original cinque sure enough iPhone,Positive
s huge step leather case replace,Positive
get new iPhone Pro straight trading Pro suffer forthwith notice huge difference picture quality use phone daily photograph sell sneaker online camera important thing talk apple try software issue maybe get defective product say look normal picture Nike Air Max shoe take photo light boxwood Pro second bright true color Pro shoe nike background look yellow take exact way have issue quality,Positive
s huge step leather case replace,Positive
iPhone seven year swelled able rising slope big investment work thank people respond carry time investiture self aggrandising want share,Positive
take picture mental picture like one attach live delay upto concluding view unspoilt good picture end look like impression pls help,Positive
iphone pro face absolutely consequence pro keep donjon willing acclivity pro consequence professional feeling hold,Positive
long year handful android phone finally iPhone brief phone history iPhone iPhone XS Max > Galaxy fold > Pixel > Galaxy Flip > Pixel pro > Galaxy Flip > Galaxy Flip finally plus receive Thursday m honeymoon phase thing m enjoy interahamwe iPhone Battery life battery life plus insane not hard feat come foldable flip know bad battery life Pixel pro mah battery abbreviated terrible battery life social medium app camera quality android come long way near iPhones especially limit phone model s series optimise degree foldable not etc App quality app well design ios tactual feedback present rd professional party app smarthome app run well banking app etc reliability m abbreviated worried go wrong iPhone android phone iPhone camera usable image single time Samsung especially Pixel capture impressive shot take shot WTF samsung slow shutter speed shutter lag impossible shot dog pixel questionable video quality Pro terrible camera literally friend ask camera crack bad quality video calling connectivity pixel pro know connectivity issue man not ready bad struggle reception normally phone gps suck point recalibrate google map time Flip lose connection m mobile datum need restart phone lastly incident week like joke friend ask m iPhone friend decide Yo Chi frozen yoghurt place Australia decide sign member go download app not let not compatible device Flip TLDR m enjoy time iPhone plus m sure honeymoon phase Ill annoy ios quirk right m like Plus,Negative
"good morning 

 pick iPhone   pm Natural Titanium Friday box scratch decide Mothers Mag try send Lo behold trick want let people know light scratch frame polishable impact finish",Positive
editing get behind non weird color issue vanish single shot overexposed need manually drag disappear exposure iPhone professional pro see thing like iPhone,Negative
"iPhone   seven year able upgrade big investment work 

 thank people respond post time want share",Positive
care manage use up picture like one attach lively concluding hold upto final view good picture end look like pls help,Positive
get new iPhone Pro trading Pro immediately notice blue ribbon huge difference picture quality use phone daily photograph sell sneaker online tv camera important thing talk apple try software issue maybe get defective product say look normal picture Nike Air select Max shoe take photo light box Pro second bright straight color Pro shoe background look yellow take exact way have day by day issue quality,Positive
camera battery life feel free part pic comment color rich person get have hard aliveness time find professional free people Pro Max lol,Positive
gift iPhone pro deliver yesterday morning yesterday evening send Network not sort contract time get play upgrade iPhone normal pro excited huge difference not feel feel ve big difference previous upgrade take photo th zoom not difference sound quality pro hear breath record feel like white colour strong screen make video photo feel dramatic play falsify pro former compare read notice play long upgrade select feel huge wait especially pro model,Positive
"
 iPhone   battery health",Neutral
datum check phone buy,Neutral
editing not weird color issue individual melt single shot overexposed need manually drag exposure iPhone professional see the like fritter away thing like iPhone,Positive
ve tear color s favorite order white m think change natural not decide,Positive
see ton negative computer software review \-easily crack trending example moment \-battery easily drain limited review \-overheate \-buggy software lesson deserving bribe,Negative
long year handful android phone finally iPhone brief phone unacceptable history iPhone iPhone XS Max > Galaxy fold > Pixel > Galaxy Flip > Pixel pro > Galaxy Flip > Galaxy Flip finally plus receive Thursday m honeymoon phase thing m enjoy far iPhone Battery life battery life plus insane not hard feat come foldable flip know bad battery life Pixel pro mah battery terrible battery life social medium app camera quality android come long way near iPhones especially limit phone model s series optimise degree foldable not etc App quality app well design ios haptic feedback present rd party app smarthome app run well banking app etc reliability m worried go wrong iPhone android phone iPhone camera usable image single time Samsung especially Pixel capture impressive shot take shot WTF samsung slow shutter speed shutter lag impossible shot dog pixel confutative video quality Pro terrible camera literally friend ask camera crack bad quality video calling connectivity pixel pro know connectivity issue man not ready bad struggle reception normally phone gps suck point recalibrate google map mechanical man time Flip lose connection m mobile datum need restart phone lastly incident week like joke friend ask m iPhone friend decide Yo Chi frozen yoghurt place Australia decide sign member go download app not let not compatible device Flip TLDR m enjoy time iPhone plus m sure honeymoon phase Ill annoy ios quirk right m mechanical man like addition,Negative
datum check phone buy,Neutral
editing not weird cut charm color issue disappear single shot overexpose need manually drag melt exposure iPhone pro catch thing like iPhone,Negative
iPhone military post seven year capable upgrade big investment subject work lack thank people reply post time want share,Positive
ve tear color s favorite order white m think change natural not decide,Positive
comparable survey previous like iPhone original old vanadium alike iPhone,Positive
long year handful android phone finally iPhone brief phone inauspicious history iPhone iPhone XS Max > Galaxy fold > Pixel > Galaxy Flip > Pixel pro > Galaxy Flip > Galaxy Flip finally plus receive Thursday m honeymoon phase thing m enjoy far iPhone Battery life battery life plus insane not punishing feat come foldable flip know optimize bad battery life Pixel pro mah battery terrible battery life social medium app camera quality android come long way near iPhones especially limit phone model s series optimise degree foldable not etc App quality app well design ios haptic feedback present galax rd party app smarthome app run well banking app etc reliability m worried go wrong iPhone android phone iPhone camera usable image single time Samsung especially Pixel capture impressive shot take shot WTF samsung slow shutter speed shutter lag impossible shot dog pixel questionable video quality Pro terrible camera literally friend ask camera crack bad quality video calling connectivity pixel pro know connectivity issue man not ready bad struggle reception normally phone gps give suck point recalibrate google map time Flip lose connection m mobile datum need restart phone lastly incident week like joke friend ask m iPhone friend decide Yo Chi frozen yoghurt place Australia decide sign member go download app not let not compatible device Flip TLDR m enjoy time iPhone plus m sure honeymoon phase Ill annoy ios quirk right m like Plus,Positive
editing not vanish weird color issue disappear single shot overexpose need manually drag exposure iPhone view pro watch thing like go away iPhone,Positive
s huge vast sulfur immense measure leather case replace,Positive
get new Pro seminal fluid Max anybody discoloration underneath issue forth volume button come kod out slur fingerprint,Neutral
